{
  "ir_version": "0.2.0",
  "compiler_version": "test",
  "source": {
    "path": "TypedBindingFixture.xaml",
    "hash": "fnv1a64:0123456789abcdef"
  },
  "class_name": "Tests.TypedBindingCard",
  "binding_context_type": "Tests.TypedBindingContext",
  "features": ["bindings"],
  "nodes": [
    {
      "id": 0,
      "kind": "userControl",
      "parent": null,
      "children": [],
      "text": null
    }
  ],
  "properties": [],
  "named_slots": [],
  "bindings": [
    {
      "target_node": 0,
      "target_property": "Text",
      "source_path": ["ResultText"],
      "mode": "oneTime",
      "invalidation": []
    }
  ],
  "resources": [],
  "actions": [],
  "semantics": []
}
